<?xml version="1.0" encoding="UTF-8"?>
<Clan xmlns="http://www.parlament.gov.rs/clan"
 xmlns:xsi="http://www.w3.org/2001/XMLSchema-instance"
 xsi:schemaLocation="http://www.parlament.gov.rs/clan file:/D:/4.%20godina/XML/app/HelloWeb01/HelloWeb/data/xsd/clan.xsd" ID="1582105513">
    <Opis>Opis clana</Opis>
    <Naziv>Clan br. 1</Naziv>
    <Sadrzaj>
        <Stav>Stav br. 1</Stav>
        <Tekst>
            <Clan ID="1572382299">
                <Opis>Opis unutrasnjeg clana</Opis>
                <Naziv>Naziv unutrasnjeg clana</Naziv>
                <Sadrzaj>
                    <Tekst>Samo obican tekst
                    </Tekst>
                    <Stav>Stav br. 2</Stav>
                    <Tekst>
                    </Tekst>
                </Sadrzaj>
            </Clan>
        </Tekst>
        <Stav>Stab br. 3</Stav>
    </Sadrzaj>
</Clan>
